[
  {
    "pope_id": "pope-001",
    "person_sequence": 1,
    "papal_name": "Peter",
    "display_name": "Peter",
    "slug": "peter",
    "canonization_status": "Saint",
    "person_status": "canonical-pope",
    "birth_name": "",
    "birth_place": "",
    "origin": "",
    "religious_order": "",
    "notes": "",
    "source_basis": "Canonical person list derived from the supplied source list and aligned to an Annuario Pontificio-style separation of canonical popes and antipopes."
  },
  {
    "pope_id": "pope-002",
    "person_sequence": 2,
    "papal_name": "Linus",
    "display_name": "Linus",
    "slug": "linus",
    "canonization_status": "Saint",
    "person_status": "canonical-pope",
    "birth_name": "",
    "birth_place": "",
    "origin": "",
    "religious_order": "",
    "notes": "",
    "source_basis": "Canonical person list derived from the supplied source list and aligned to an Annuario Pontificio-style separation of canonical popes and antipopes."
  },
  {
    "pope_id": "pope-003",
    "person_sequence": 3,
    "papal_name": "Anacletus",
    "display_name": "Anacletus",
    "slug": "anacletus",
    "canonization_status": "Saint",
    "person_status": "canonical-pope",
    "birth_name": "",
    "birth_place": "",
    "origin": "",
    "religious_order": "",
    "notes": "Source list label: St. Anacletus (Cletus).",
    "source_basis": "Canonical person list derived from the supplied source list and aligned to an Annuario Pontificio-style separation of canonical popes and antipopes."
  },
  {
    "pope_id": "pope-004",
    "person_sequence": 4,
    "papal_name": "Clement I",
    "display_name": "Clement I",
    "slug": "clement-i",
    "canonization_status": "Saint",
    "person_status": "canonical-pope",
    "birth_name": "",
    "birth_place": "",
    "origin": "",
    "religious_order": "",
    "notes": "",
    "source_basis": "Canonical person list derived from the supplied source list and aligned to an Annuario Pontificio-style separation of canonical popes and antipopes."
  },
  {
    "pope_id": "pope-005",
    "person_sequence": 5,
    "papal_name": "Evaristus",
    "display_name": "Evaristus",
    "slug": "evaristus",
    "canonization_status": "Saint",
    "person_status": "canonical-pope",
    "birth_name": "",
    "birth_place": "",
    "origin": "",
    "religious_order": "",
    "notes": "",
    "source_basis": "Canonical person list derived from the supplied source list and aligned to an Annuario Pontificio-style separation of canonical popes and antipopes."
  },
  {
    "pope_id": "pope-006",
    "person_sequence": 6,
    "papal_name": "Alexander I",
    "display_name": "Alexander I",
    "slug": "alexander-i",
    "canonization_status": "Saint",
    "person_status": "canonical-pope",
    "birth_name": "",
    "birth_place": "",
    "origin": "",
    "religious_order": "",
    "notes": "",
    "source_basis": "Canonical person list derived from the supplied source list and aligned to an Annuario Pontificio-style separation of canonical popes and antipopes."
  },
  {
    "pope_id": "pope-007",
    "person_sequence": 7,
    "papal_name": "Sixtus I",
    "display_name": "Sixtus I",
    "slug": "sixtus-i",
    "canonization_status": "Saint",
    "person_status": "canonical-pope",
    "birth_name": "",
    "birth_place": "",
    "origin": "",
    "religious_order": "",
    "notes": "",
    "source_basis": "Canonical person list derived from the supplied source list and aligned to an Annuario Pontificio-style separation of canonical popes and antipopes."
  },
  {
    "pope_id": "pope-008",
    "person_sequence": 8,
    "papal_name": "Telesphorus",
    "display_name": "Telesphorus",
    "slug": "telesphorus",
    "canonization_status": "Saint",
    "person_status": "canonical-pope",
    "birth_name": "",
    "birth_place": "",
    "origin": "",
    "religious_order": "",
    "notes": "",
    "source_basis": "Canonical person list derived from the supplied source list and aligned to an Annuario Pontificio-style separation of canonical popes and antipopes."
  },
  {
    "pope_id": "pope-009",
    "person_sequence": 9,
    "papal_name": "Hyginus",
    "display_name": "Hyginus",
    "slug": "hyginus",
    "canonization_status": "Saint",
    "person_status": "canonical-pope",
    "birth_name": "",
    "birth_place": "",
    "origin": "",
    "religious_order": "",
    "notes": "",
    "source_basis": "Canonical person list derived from the supplied source list and aligned to an Annuario Pontificio-style separation of canonical popes and antipopes."
  },
  {
    "pope_id": "pope-010",
    "person_sequence": 10,
    "papal_name": "Pius I",
    "display_name": "Pius I",
    "slug": "pius-i",
    "canonization_status": "Saint",
    "person_status": "canonical-pope",
    "birth_name": "",
    "birth_place": "",
    "origin": "",
    "religious_order": "",
    "notes": "",
    "source_basis": "Canonical person list derived from the supplied source list and aligned to an Annuario Pontificio-style separation of canonical popes and antipopes."
  },
  {
    "pope_id": "pope-011",
    "person_sequence": 11,
    "papal_name": "Anicetus",
    "display_name": "Anicetus",
    "slug": "anicetus",
    "canonization_status": "Saint",
    "person_status": "canonical-pope",
    "birth_name": "",
    "birth_place": "",
    "origin": "",
    "religious_order": "",
    "notes": "",
    "source_basis": "Canonical person list derived from the supplied source list and aligned to an Annuario Pontificio-style separation of canonical popes and antipopes."
  },
  {
    "pope_id": "pope-012",
    "person_sequence": 12,
    "papal_name": "Soter",
    "display_name": "Soter",
    "slug": "soter",
    "canonization_status": "Saint",
    "person_status": "canonical-pope",
    "birth_name": "",
    "birth_place": "",
    "origin": "",
    "religious_order": "",
    "notes": "",
    "source_basis": "Canonical person list derived from the supplied source list and aligned to an Annuario Pontificio-style separation of canonical popes and antipopes."
  },
  {
    "pope_id": "pope-013",
    "person_sequence": 13,
    "papal_name": "Eleutherius",
    "display_name": "Eleutherius",
    "slug": "eleutherius",
    "canonization_status": "Saint",
    "person_status": "canonical-pope",
    "birth_name": "",
    "birth_place": "",
    "origin": "",
    "religious_order": "",
    "notes": "",
    "source_basis": "Canonical person list derived from the supplied source list and aligned to an Annuario Pontificio-style separation of canonical popes and antipopes."
  },
  {
    "pope_id": "pope-014",
    "person_sequence": 14,
    "papal_name": "Victor I",
    "display_name": "Victor I",
    "slug": "victor-i",
    "canonization_status": "Saint",
    "person_status": "canonical-pope",
    "birth_name": "",
    "birth_place": "",
    "origin": "",
    "religious_order": "",
    "notes": "",
    "source_basis": "Canonical person list derived from the supplied source list and aligned to an Annuario Pontificio-style separation of canonical popes and antipopes."
  },
  {
    "pope_id": "pope-015",
    "person_sequence": 15,
    "papal_name": "Zephyrinus",
    "display_name": "Zephyrinus",
    "slug": "zephyrinus",
    "canonization_status": "Saint",
    "person_status": "canonical-pope",
    "birth_name": "",
    "birth_place": "",
    "origin": "",
    "religious_order": "",
    "notes": "",
    "source_basis": "Canonical person list derived from the supplied source list and aligned to an Annuario Pontificio-style separation of canonical popes and antipopes."
  },
  {
    "pope_id": "pope-016",
    "person_sequence": 16,
    "papal_name": "Callixtus I",
    "display_name": "Callixtus I",
    "slug": "callixtus-i",
    "canonization_status": "Saint",
    "person_status": "canonical-pope",
    "birth_name": "",
    "birth_place": "",
    "origin": "",
    "religious_order": "",
    "notes": "",
    "source_basis": "Canonical person list derived from the supplied source list and aligned to an Annuario Pontificio-style separation of canonical popes and antipopes."
  },
  {
    "pope_id": "pope-017",
    "person_sequence": 17,
    "papal_name": "Urban I",
    "display_name": "Urban I",
    "slug": "urban-i",
    "canonization_status": "Saint",
    "person_status": "canonical-pope",
    "birth_name": "",
    "birth_place": "",
    "origin": "",
    "religious_order": "",
    "notes": "",
    "source_basis": "Canonical person list derived from the supplied source list and aligned to an Annuario Pontificio-style separation of canonical popes and antipopes."
  },
  {
    "pope_id": "pope-018",
    "person_sequence": 18,
    "papal_name": "Pontian",
    "display_name": "Pontian",
    "slug": "pontian",
    "canonization_status": "Saint",
    "person_status": "canonical-pope",
    "birth_name": "",
    "birth_place": "",
    "origin": "",
    "religious_order": "",
    "notes": "",
    "source_basis": "Canonical person list derived from the supplied source list and aligned to an Annuario Pontificio-style separation of canonical popes and antipopes."
  },
  {
    "pope_id": "pope-019",
    "person_sequence": 19,
    "papal_name": "Anterus",
    "display_name": "Anterus",
    "slug": "anterus",
    "canonization_status": "Saint",
    "person_status": "canonical-pope",
    "birth_name": "",
    "birth_place": "",
    "origin": "",
    "religious_order": "",
    "notes": "",
    "source_basis": "Canonical person list derived from the supplied source list and aligned to an Annuario Pontificio-style separation of canonical popes and antipopes."
  },
  {
    "pope_id": "pope-020",
    "person_sequence": 20,
    "papal_name": "Fabian",
    "display_name": "Fabian",
    "slug": "fabian",
    "canonization_status": "Saint",
    "person_status": "canonical-pope",
    "birth_name": "",
    "birth_place": "",
    "origin": "",
    "religious_order": "",
    "notes": "",